platform,title_raw,title_clean,cleaned_text,full_description,tokens,token_count,budget_extracted,budget_currency,budget_type,skills_clean,category_clean,posted_date
Mostaqel.com,متخصص تطوير شراكات B2B – مجال الخصومات والأفلييت,متخصص تطوير شراكات b2b مجال الخصومات والافلييت شخص لديه خبره مجال b2b business business,متخصص تطوير شراكات b2b مجال الخصومات والافلييت شخص لديه خبره مجال b2b business business,نبحث عن شخص لديه خبرة في مجال B2B (Business to Business)،,متخصص | تطوير | شراكات | b2b | مجال | الخصومات | والافلييت | شخص | لديه | خبره | مجال | b2b | business | business,14,,,unknown,,,2026-05-05 14:46:20
Mostaqel.com,أخصائي حملات ممولة,اخصايي حملات مموله شخص لديه خبره اداره الحملات المموله paid ads,اخصايي حملات مموله شخص لديه خبره اداره الحملات المموله paid ads,نبحث عن شخص لديه خبرة في إدارة الحملات الممولة (Paid Ads)،,اخصايي | حملات | مموله | شخص | لديه | خبره | اداره | الحملات | المموله | paid | ads,11,,,unknown,,,2026-05-05 14:45:39
Mostaqel.com,"خبير نقل بيانات (Migration) وتطوير واجهة متجر إلكتروني من ""سلة"" إلى موقع خاص",خبير نقل بيانات migration وتطوير واجهه متجر الكتروني سله الي موقع خاص وصف,خبير نقل بيانات migration وتطوير واجهه متجر الكتروني سله الي موقع خاص وصف,وصف المشروع:,خبير | نقل | بيانات | migration | وتطوير | واجهه | متجر | الكتروني | سله | الي | موقع | خاص | وصف,13,,,unknown,,,2026-05-05 14:16:11
Mostaqel.com,خبير في إعلانات Google Ads للتسويق لمتجر إلكتروني متخصص في المنتجات الرقمية,خبير اعلانات google ads للتسويق لمتجر الكتروني متخصص المنتجات الرقميه لدينا متجر الكتروني متخصص بيع المنتجات الرقميه ونر,خبير اعلانات google ads للتسويق لمتجر الكتروني متخصص المنتجات الرقميه لدينا متجر الكتروني متخصص بيع المنتجات الرقميه ونرغب بالتسويق اجل زياده المبيعات.,لدينا متجر إلكتروني متخصص في بيع المنتجات الرقمية ونرغب بالتسويق له من أجل زيادة المبيعات.,خبير | اعلانات | google | ads | للتسويق | لمتجر | الكتروني | متخصص | المنتجات | الرقميه | لدينا | متجر | الكتروني | متخصص | بيع | المنتجات | الرقميه | ونرغب | بالتسويق | اجل | زياده | المبيعات.,22,,,unknown,,,2026-05-05 14:13:43
Mostaqel.com,عمل فديو شرح لطريقة استخدام موقع,عمل فديو شرح لطريقه استخدام موقع اريد شخص خبير لعمل شرح فديو لطريقه استخدام الموقع وطبعا يكون بدون صوت شخص الشرح السهل ا,عمل فديو شرح لطريقه استخدام موقع اريد شخص خبير لعمل شرح فديو لطريقه استخدام الموقع وطبعا يكون بدون صوت شخص الشرح السهل المفتاح لسهوله استخدام الموقع علما اني ارغب بفهم الفكره لاي شخص حتي يفهم المكتوب الموقع يفهم اللغه ومحتاج الشرح يكون سريع جدا حوالي 30 ثانيه او اقل ويكون بجوده عاليه,اريد شخص خبير لعمل شرح فديو لطريقة استخدام الموقع وطبعا يكون بدون صوت شخص ولكن الشرح السهل هو المفتاح لسهوله استخدام الموقع علما اني ارغب بفهم الفكره لأي شخص حتى لو لم يفهم المكتوب في الموقع (لم يفهم اللغه) ومحتاج الشرح يكون سريع جدا حوالي 30 ثانيه او اقل ويكون بجوده عاليه,عمل | فديو | شرح | لطريقه | استخدام | موقع | اريد | شخص | خبير | لعمل | شرح | فديو | لطريقه | استخدام | الموقع | وطبعا | يكون | بدون | صوت | شخص | الشرح | السهل | المفتاح | لسهوله | استخدام | الموقع | علما | اني | ارغب | بفهم | الفكره | لاي | شخص | حتي | يفهم | المكتوب | الموقع | يفهم | اللغه | ومحتاج | الشرح | يكون | سريع | جدا | حوالي | 30 | ثانيه | او | اقل | ويكون | بجوده | عاليه,52,,,unknown,,,2026-05-05 14:12:43
Mostaqel.com,تطوير تطبيق توصيل طلبات,تطوير تطبيق توصيل طلبات نرغب توظيف مطور لتصميم وتطوير نظام تطبيق لتوصيل الطلبات مشابه لتطبيقات التوصيل المعروفه بحيث يشم,تطوير تطبيق توصيل طلبات نرغب توظيف مطور لتصميم وتطوير نظام تطبيق لتوصيل الطلبات مشابه لتطبيقات التوصيل المعروفه بحيث يشمل,نرغب في توظيف مطور لتصميم وتطوير نظام/تطبيق لتوصيل الطلبات (مشابه لتطبيقات التوصيل المعروفة)، بحيث يشمل:,تطوير | تطبيق | توصيل | طلبات | نرغب | توظيف | مطور | لتصميم | وتطوير | نظام | تطبيق | لتوصيل | الطلبات | مشابه | لتطبيقات | التوصيل | المعروفه | بحيث | يشمل,19,,,unknown,,,2026-05-05 13:56:17
Mostaqel.com,تعديل وتصميم بروفايل مؤسسة مقاولات,تعديل وتصميم بروفايل موسسه مقاولات موجود البروفايل سابقا المطلوب التعديل والاضافه للاوراق والصور للمشاريع عمل تعديلات لب,تعديل وتصميم بروفايل موسسه مقاولات موجود البروفايل سابقا المطلوب التعديل والاضافه للاوراق والصور للمشاريع عمل تعديلات لبعض الصور واضافتها للبروفايل,موجود البروفايل سابقا المطلوب التعديل والاضافة للاوراق والصور للمشاريع مع عمل تعديلات لبعض الصور واضافتها للبروفايل,تعديل | وتصميم | بروفايل | موسسه | مقاولات | موجود | البروفايل | سابقا | المطلوب | التعديل | والاضافه | للاوراق | والصور | للمشاريع | عمل | تعديلات | لبعض | الصور | واضافتها | للبروفايل,20,,,unknown,,,2026-05-05 13:47:41
Mostaqel.com,تصميم صفحة هبوط احترافية للتسويق للتطبيق الكتروني,تصميم صفحه هبوط احترافيه للتسويق للتطبيق الكتروني نبي مصمم محترف يصمم صفحه هبوط مختصره لتطبيق الكتروني للتسويقه عبر المن,تصميم صفحه هبوط احترافيه للتسويق للتطبيق الكتروني نبي مصمم محترف يصمم صفحه هبوط مختصره لتطبيق الكتروني للتسويقه عبر المنصات,نبي مصمم محترف يصمم صفحة هبوط مختصره لتطبيق الكتروني للتسويقه عبر المنصات,تصميم | صفحه | هبوط | احترافيه | للتسويق | للتطبيق | الكتروني | نبي | مصمم | محترف | يصمم | صفحه | هبوط | مختصره | لتطبيق | الكتروني | للتسويقه | عبر | المنصات,19,,,unknown,,,2026-05-05 13:47:40
Mostaqel.com,تصميم بروفايل احترافي لشركة,تصميم بروفايل احترافي لشركه نرغب بتصميم احترافي لبروفايل شركه يحتوي علي,تصميم بروفايل احترافي لشركه نرغب بتصميم احترافي لبروفايل شركه يحتوي علي,نرغب بتصميم احترافي لبروفايل شركة يحتوي على,تصميم | بروفايل | احترافي | لشركه | نرغب | بتصميم | احترافي | لبروفايل | شركه | يحتوي | علي,11,,,unknown,,,2026-05-05 13:47:18
Mostaqel.com,تجميع بيانات عقارية,تجميع بيانات عقاريه مدخل بيانات لديه خبره المجال العقاري، لاعداد شيتات اكسيل للمتاح بالمساحات والاسعار مشروعات عقاريه ال,تجميع بيانات عقاريه مدخل بيانات لديه خبره المجال العقاري، لاعداد شيتات اكسيل للمتاح بالمساحات والاسعار مشروعات عقاريه الداتا متوفره، والمطلوب تنظيمها بشكل منظم ومجمع لجميع المشاريع,مطلوب مدخل بيانات لديه خبرة في المجال العقاري، لإعداد شيتات اكسيل للمتاح بالمساحات والاسعار في مشروعات عقاريه الداتا متوفرة، والمطلوب تنظيمها بشكل منظم ومجمع لجميع المشاريع,تجميع | بيانات | عقاريه | مدخل | بيانات | لديه | خبره | المجال | العقاري، | لاعداد | شيتات | اكسيل | للمتاح | بالمساحات | والاسعار | مشروعات | عقاريه | الداتا | متوفره، | والمطلوب | تنظيمها | بشكل | منظم | ومجمع | لجميع | المشاريع,26,,,unknown,,,2026-05-05 13:46:48
Mostaqel.com,إنشاء وتطوير موقع إلكتروني مخصص لشركة مقاولات,انشاء وتطوير موقع الكتروني مخصص لشركه مقاولات السلام عليكم،,انشاء وتطوير موقع الكتروني مخصص لشركه مقاولات السلام عليكم،,السلام عليكم،,انشاء | وتطوير | موقع | الكتروني | مخصص | لشركه | مقاولات | السلام | عليكم،,9,,,unknown,,,2026-05-05 13:45:51
Mostaqel.com,إعداد قوائم مالية لجمعية غير ربحية (بدون إيرادات حالياً),اعداد قوايم ماليه لجمعيه ربحيه بدون ايرادات حاليا محاسب لديه خبره القطاع الربحي لاعداد قوايم ماليه لجمعيه اهليه جمعيه نب,اعداد قوايم ماليه لجمعيه ربحيه بدون ايرادات حاليا محاسب لديه خبره القطاع الربحي لاعداد قوايم ماليه لجمعيه اهليه جمعيه نبرمج,نبحث عن محاسب لديه خبرة في القطاع غير الربحي لإعداد قوائم مالية لجمعية أهلية (جمعية نبرمج).,اعداد | قوايم | ماليه | لجمعيه | ربحيه | بدون | ايرادات | حاليا | محاسب | لديه | خبره | القطاع | الربحي | لاعداد | قوايم | ماليه | لجمعيه | اهليه | جمعيه | نبرمج,20,,,unknown,,,2026-05-05 13:35:20
Mostaqel.com,تعديل وإعادة عمل ملف إكسيل لمشروع فندقي,تعديل واعاده عمل ملف اكسيل لمشروع فندقي يوجد لدي ملف اكسيل لقوايم ماليه لمشروع سكني فندقي باللغه الانجليزيه ..,تعديل واعاده عمل ملف اكسيل لمشروع فندقي يوجد لدي ملف اكسيل لقوايم ماليه لمشروع سكني فندقي باللغه الانجليزيه ..,يوجد لدي ملف إكسيل لقوائم مالية لمشروع سكني فندقي باللغة الانجليزية ..,تعديل | واعاده | عمل | ملف | اكسيل | لمشروع | فندقي | يوجد | لدي | ملف | اكسيل | لقوايم | ماليه | لمشروع | سكني | فندقي | باللغه | الانجليزيه | ..,19,,,unknown,,,2026-05-05 13:34:42
Mostaqel.com,إنشاء متجر أولي على منصة سلة,انشاء متجر اولي علي منصه سله تم رفع ملف شرح مفصل,انشاء متجر اولي علي منصه سله تم رفع ملف شرح مفصل,تم رفع ملف مع شرح مفصل,انشاء | متجر | اولي | علي | منصه | سله | تم | رفع | ملف | شرح | مفصل,11,,,unknown,,,2026-05-05 13:33:17
Mostaqel.com,تطوير تطبيق مالي متكامل,تطوير تطبيق مالي متكامل تطوير تطبيق مالي متكامل fintech للحوالات، الخدمات الرقميه، ومحافظ usdt ios android,تطوير تطبيق مالي متكامل تطوير تطبيق مالي متكامل fintech للحوالات، الخدمات الرقميه، ومحافظ usdt ios android,تطوير تطبيق مالي متكامل (FinTech) للحوالات، الخدمات الرقمية، ومحافظ USDT (iOS & Android),تطوير | تطبيق | مالي | متكامل | تطوير | تطبيق | مالي | متكامل | fintech | للحوالات، | الخدمات | الرقميه، | ومحافظ | usdt | ios | android,16,,,unknown,,,2026-05-05 13:33:05
Mostaqel.com,تنفيذ خطة SEO شاملة لموقع Stone Beam Demolition وتحسين الأداء التقني والمحتوى والتتبع,تنفيذ خطه seo شامله لموقع stone beam demolition وتحسين الاداء التقني والمحتوي والتتبع تفاصيل,تنفيذ خطه seo شامله لموقع stone beam demolition وتحسين الاداء التقني والمحتوي والتتبع تفاصيل,تفاصيل المشروع,تنفيذ | خطه | seo | شامله | لموقع | stone | beam | demolition | وتحسين | الاداء | التقني | والمحتوي | والتتبع | تفاصيل,14,,,unknown,,,2026-05-05 13:32:43
Mostaqel.com,تصميم بورتفوليو شخصي إحترافي من الصفر,تصميم بورتفوليو شخصي احترافي الصفر تصميم بورتفوليو ملف اعمال شخصي احترافي pdf,تصميم بورتفوليو شخصي احترافي الصفر تصميم بورتفوليو ملف اعمال شخصي احترافي pdf,تصميم بورتفوليو (ملف أعمال) شخصي احترافي PDF,تصميم | بورتفوليو | شخصي | احترافي | الصفر | تصميم | بورتفوليو | ملف | اعمال | شخصي | احترافي | pdf,12,,,unknown,,,2026-05-05 13:27:05
Mostaqel.com,محلل أعمال تقني لإكمال وثيقة BRD + SRS لمشروع لوجستي,محلل اعمال تقني لاكمال وثيقه brd srs لمشروع لوجستي,محلل اعمال تقني لاكمال وثيقه brd srs لمشروع لوجستي,المشروع:,محلل | اعمال | تقني | لاكمال | وثيقه | brd | srs | لمشروع | لوجستي,9,,,unknown,,,2026-05-05 13:02:10
Mostaqel.com,مونتاج احترافي لفيديو,مونتاج احترافي لفيديو مونتاج احترافي لفيديو مدته دقيقه,مونتاج احترافي لفيديو مونتاج احترافي لفيديو مدته دقيقه,مونتاج احترافي لفيديو مدته 2 دقيقة,مونتاج | احترافي | لفيديو | مونتاج | احترافي | لفيديو | مدته | دقيقه,8,,,unknown,,,2026-05-05 12:41:53
Mostaqel.com,تصميم كيس أعلاف خاص لمركز نوبل ستيد,تصميم كيس اعلاف خاص لمركز نوبل ستيد ملخص تصميم هويه بصريه وتغليف لاكياس اعلاف خيول,تصميم كيس اعلاف خاص لمركز نوبل ستيد ملخص تصميم هويه بصريه وتغليف لاكياس اعلاف خيول,ملخص المشروع: تصميم هوية بصرية وتغليف لأكياس أعلاف خيول,تصميم | كيس | اعلاف | خاص | لمركز | نوبل | ستيد | ملخص | تصميم | هويه | بصريه | وتغليف | لاكياس | اعلاف | خيول,15,,,unknown,,,2026-05-05 12:40:11
Mostaqel.com,تعديل وحل أخطاء بتطبيق flutter واضافة اشياء,تعديل وحل اخطاء بتطبيق flutter واضافه اشياء السلام عليكم,تعديل وحل اخطاء بتطبيق flutter واضافه اشياء السلام عليكم,"السلام عليكم,",تعديل | وحل | اخطاء | بتطبيق | flutter | واضافه | اشياء | السلام | عليكم,9,,,unknown,,,2026-05-05 12:30:12
Mostaqel.com,أخصائي أداء وتسويق رقمي للمتجر الإلكتروني (Media Buyer),اخصايي اداء وتسويق رقمي للمتجر الالكتروني media buyer اخصايي حملات اعلانيه محترف لاداره وتطوير الحملات التسويقيه لمتجر ا,اخصايي اداء وتسويق رقمي للمتجر الالكتروني media buyer اخصايي حملات اعلانيه محترف لاداره وتطوير الحملات التسويقيه لمتجر الكتروني متخصص مجال الاناره، بهدف زياده المبيعات وتحقيق اعلي عايد علي الانفاق الاعلاني عبر منصات الاعلان المختلفه.,نبحث عن أخصائي حملات إعلانية محترف لإدارة وتطوير الحملات التسويقية لمتجر إلكتروني متخصص في مجال الإنارة، بهدف زيادة المبيعات وتحقيق أعلى عائد على الإنفاق الإعلاني عبر منصات الإعلان المختلفة.,اخصايي | اداء | وتسويق | رقمي | للمتجر | الالكتروني | media | buyer | اخصايي | حملات | اعلانيه | محترف | لاداره | وتطوير | الحملات | التسويقيه | لمتجر | الكتروني | متخصص | مجال | الاناره، | بهدف | زياده | المبيعات | وتحقيق | اعلي | عايد | علي | الانفاق | الاعلاني | عبر | منصات | الاعلان | المختلفه.,34,,,unknown,,,2026-05-05 12:28:26
Mostaqel.com,سكرتيرة عن بُعد لمدة شهر واحد,سكرتيره لمده شهر سكرتير سكرتيره لمده شهر واحد، للمساعده تنفيذ مهام متنوعه وتنسيق اعمال مختلفه توجيهات الاداره.,سكرتيره لمده شهر سكرتير سكرتيره لمده شهر واحد، للمساعده تنفيذ مهام متنوعه وتنسيق اعمال مختلفه توجيهات الاداره.,مطلوب سكرتير / سكرتيرة عن بُعد لمدة شهر واحد، للمساعدة في تنفيذ مهام متنوعة وتنسيق أعمال مختلفة حسب توجيهات الإدارة.,سكرتيره | لمده | شهر | سكرتير | سكرتيره | لمده | شهر | واحد، | للمساعده | تنفيذ | مهام | متنوعه | وتنسيق | اعمال | مختلفه | توجيهات | الاداره.,17,,,unknown,,,2026-05-05 12:28:06
Mostaqel.com,محاسب عام – لشركة قابضة وشركة تابعة,محاسب عام لشركه قابضه وشركه تابعه ضمن توسعنا، محاسب عام احترافي يمتلك خبره قويه لاداره المنظومه الماليه بشكل متكامل لشرك,محاسب عام لشركه قابضه وشركه تابعه ضمن توسعنا، محاسب عام احترافي يمتلك خبره قويه لاداره المنظومه الماليه بشكل متكامل لشركه قابضه وشركه تابعه لها، وفق اعلي المعايير المهنيه والتنظيميه.,ضمن توسّعنا، نبحث عن محاسب عام احترافي يمتلك خبرة قوية لإدارة المنظومة المالية بشكل متكامل لشركة قابضة وشركة تابعة لها، وفق أعلى المعايير المهنية والتنظيمية.,محاسب | عام | لشركه | قابضه | وشركه | تابعه | ضمن | توسعنا، | محاسب | عام | احترافي | يمتلك | خبره | قويه | لاداره | المنظومه | الماليه | بشكل | متكامل | لشركه | قابضه | وشركه | تابعه | لها، | وفق | اعلي | المعايير | المهنيه | والتنظيميه.,29,,,unknown,,,2026-05-05 12:24:40
Mostaqel.com,كاتب محتوى للمساعدة في إعداد ملزمة تعليمية موجهة لطلاب الجامعة,كاتب محتوي للمساعده اعداد ملزمه تعليميه موجهه لطلاب الجامعه وصف,كاتب محتوي للمساعده اعداد ملزمه تعليميه موجهه لطلاب الجامعه وصف,وصف المشروع:,كاتب | محتوي | للمساعده | اعداد | ملزمه | تعليميه | موجهه | لطلاب | الجامعه | وصف,10,,,unknown,,,2026-05-05 12:23:38
Mostaqel.com,صناع محتوى مبدعين ( ترند ) تيك توك و سناب و انستقرام,صناع محتوي مبدعين ترند تيك توك سناب انستقرام موقع الكتروني قيد الانشاء لعرض الازياء دروب شوبينق,صناع محتوي مبدعين ترند تيك توك سناب انستقرام موقع الكتروني قيد الانشاء لعرض الازياء دروب شوبينق,"موقع الكتروني قيد الانشاء لعرض الازياء "" دروب شوبينق""",صناع | محتوي | مبدعين | ترند | تيك | توك | سناب | انستقرام | موقع | الكتروني | قيد | الانشاء | لعرض | الازياء | دروب | شوبينق,16,,,unknown,,,2026-05-05 12:22:21
Mostaqel.com,مصمم بوربوينت احترافي,مصمم بوربوينت احترافي ارغب مصمم محترف لعمل بوربوينت احترافي وعمل بوستر,مصمم بوربوينت احترافي ارغب مصمم محترف لعمل بوربوينت احترافي وعمل بوستر,ارغب في مصمم محترف لعمل بوربوينت احترافي  وعمل بوستر,مصمم | بوربوينت | احترافي | ارغب | مصمم | محترف | لعمل | بوربوينت | احترافي | وعمل | بوستر,11,,,unknown,,,2026-05-05 12:16:49
Mostaqel.com,فيديو تسويقي لرحلة يخت,فيديو تسويقي لرحله يخت تصميم فيديو بالذكاء الصناعي لرحله يخت شامله ورشه نفسيه ويوجا وغداء,فيديو تسويقي لرحله يخت تصميم فيديو بالذكاء الصناعي لرحله يخت شامله ورشه نفسيه ويوجا وغداء,تصميم فيديو بالذكاء الصناعي لرحلة يخت شاملة ورشة نفسية ويوجا وغداء,فيديو | تسويقي | لرحله | يخت | تصميم | فيديو | بالذكاء | الصناعي | لرحله | يخت | شامله | ورشه | نفسيه | ويوجا | وغداء,15,,,unknown,,,2026-05-05 11:55:11
Mostaqel.com,مختص SEO لتحسين متجر إلكتروني وزيادة الظهور في نتائج البحث,مختص seo لتحسين متجر الكتروني وزياده الظهور نتايج البحث ابحث خبير seo محترف علي تحسين متجر الكتروني متخصص مجال الاناره ب,مختص seo لتحسين متجر الكتروني وزياده الظهور نتايج البحث ابحث خبير seo محترف علي تحسين متجر الكتروني متخصص مجال الاناره بهدف رفع ترتيب الموقع نتايج البحث وزياده الزيارات العضويه وتحسين معدل التحويل.,أبحث عن خبير SEO محترف للعمل على تحسين متجر إلكتروني متخصص في مجال الإنارة بهدف رفع ترتيب الموقع في نتائج البحث وزيادة الزيارات العضوية وتحسين معدل التحويل.,مختص | seo | لتحسين | متجر | الكتروني | وزياده | الظهور | نتايج | البحث | ابحث | خبير | seo | محترف | علي | تحسين | متجر | الكتروني | متخصص | مجال | الاناره | بهدف | رفع | ترتيب | الموقع | نتايج | البحث | وزياده | الزيارات | العضويه | وتحسين | معدل | التحويل.,32,,,unknown,,,2026-05-05 11:53:58
Mostaqel.com,تصميم هوية بصرية متكاملة لعلامة تجارية لمكتبة (قرطاسيات، طباعة، تغليف),تصميم هويه بصريه متكامله لعلامه تجاريه لمكتبه قرطاسيات، طباعه، تغليف وصف,تصميم هويه بصريه متكامله لعلامه تجاريه لمكتبه قرطاسيات، طباعه، تغليف وصف,**وصف المشروع:**,تصميم | هويه | بصريه | متكامله | لعلامه | تجاريه | لمكتبه | قرطاسيات، | طباعه، | تغليف | وصف,11,,,unknown,,,2026-05-05 11:40:22
