platform,title,url,budget_min,budget_max,budget_currency,budget_type,skills,category,posted_date,full_description,description_snippet
Freelancer.com,Backyard Landscape Plan & Renderings,https://www.freelancer.com/projects/landscape-design/backyard-landscape-plan-renderings,22.0,183.0,USD,fixed,2D Drafting | 2D Drawing | 3D Design | 3D Rendering | 3D Visualization | Architectural Visualization | AutoCAD | Building Architecture | Interior Design | Landscape Design,,,,"I’m ready to turn my property into a true entertainment hub and I need professionally drawn plans that capture every feature to scale. The finished package should include a clean, dimension-accurate site plan plus life-like aerial and eye-level persp"
Freelancer.com,Private project or contest #40424614,https://www.freelancer.com/login?goto=YThiYWI1ZmU4ZGQ0NjYxMjE3OTk2MGFkYmFkNmIwNzdodHRwczovL3d3dy5mcmVlbGFuY2VyLmNvbS9wcm9qZWN0cy9hcnRpY2xlcy9kaXNzZXJ0YXRpb24tY29tcGV0ZW5jZS1qb2Itc2F0aXNmYWN0aW9u,,,,unknown,Article Writing | Data Collection | Educational Research | Qualitative Research | Report Writing | Research | Research Writing | Statistical Analysis,,,,PleaseSign UporLoginto see details.
Freelancer.com,"Performance Ads Expert Needed (Meta, Google & CRM Integration)",https://www.freelancer.com/projects/google-ads/performance-ads-expert-needed-meta,63.0,63.0,USD,fixed,CRM | Digital Marketing | Facebook Ads | Google Ads | Internet Marketing | Lead Generation | Leads | PHP | Sales | Social Video Marketing,,,,"Our agency is ready to scale a residential real-estate account and I need a partner who can own the entire paid-ads-to-CRM pipeline. Both Facebook/Instagram and Google Ads have worked well for us in the past, so you will be expected to split test acr"
Freelancer.com,Salesforce Data Import Specialist,https://www.freelancer.com/projects/crm/salesforce-data-import-specialist,27.0,27.0,USD,fixed,CRM | Data Analysis | Data Entry | Data Management | Data Processing | Excel | Salesforce App Development | Salesforce.com,,,,"I need help importing data into Salesforce from CSV files. The data includes:

  - Contacts
  - Leads
  - Opportunities

The dataset is between 1,000 to 10,000 records. 

Ideal skills and experience:
  - Proficiency in Salesforce
  - Experience with "
Freelancer.com,AI Content Generator Development,https://www.freelancer.com/projects/ai-chatbot-development/content-generator-development,462.0,462.0,USD,fixed,AI Chatbot Development | AI Content Creation | AI Development | AI Model Development | AI Writing | Artificial Intelligence | CSS | HTML | HTML5 | JavaScript,,,,"<!DOCTYPE html>
<html lang=""en"">
<head>
  <meta charset=""UTF-8"" />
  <meta name=""viewport"" content=""width=device-width, initial-scale=1.0""/>
  <title>AI Content Generator</title>

  <style>
    *{
      margin:0;
      padding:0;
      box-sizing:bor"
Freelancer.com,DaVinci Resolve Training Edits,https://www.freelancer.com/projects/da-vinci-resolve/davinci-resolve-training-edits,65.0,65.0,USD,fixed,Audio Editing | DaVinci Resolve | Editing | Video Editing | Video Post-editing | Video Processing | Video Production | Video Services,,,,"I have a series of raw screen-recordings and talking-head clips that form a software training course. I need an experienced DaVinci Resolve editor to turn this footage into polished, learner-friendly modules.

The workflow is straightforward:
• Trim "
Freelancer.com,Translate Manual: English to Nepali -- 2,https://www.freelancer.com/projects/nepali-translator/translate-manual-english-nepali,300.0,300.0,USD,fixed,Copy Typing | Copywriting | Editing | English (US) Translator | English Translation | Nepali Translator | Proofreading | Technical Translation | Technical Writing | Translation,,,,"I have a manual written in English that needs to be presented to a Nepali-speaking audience. The entire text has to move over into Nepali while retaining its formal tone, technical terminology, and every bit of its existing layout—headings, bullet po"
Freelancer.com,Experienced Claude Code Developer needed,https://www.freelancer.com/projects/ai-hw-sw/experienced-claude-code-developer-needed,16.0,16.0,USD,fixed,AI (Artificial Intelligence) HW/SW | AI Agents | Claude Code | Model Context Protocol (MCP) | Next.js | OpenAI | Prompt Engineering | Python,,,,"**Job Title:** Experienced Claude Code Developer for AI Agent Platform (Vozlia)

**Project Overview:**
I'm building Vozlia, an AI agent platform, and need a skilled developer to work alongside me as a coding partner. Since I work a full-time job, I n"
Freelancer.com,Translate Manual: English to Nepali,https://www.freelancer.com/projects/editing/translate-manual-english-nepali,250.0,250.0,USD,fixed,Editing | English (US) Translator | English Translation | Nepali Translator | Proofreading | Technical Translation | Technical Writing | Translation,,,,"I have a manual written in English that needs to be presented to a Nepali-speaking audience. The entire text has to move over into Nepali while retaining its formal tone, technical terminology, and every bit of its existing layout—headings, bullet po"
Freelancer.com,Unique Modern Construction Logo Design,https://www.freelancer.com/contest/unique-modern-construction-logo-design-2736532,35.0,35.0,USD,fixed,Adobe Illustrator | Adobe Photoshop | Branding | Graphic Design | Illustrator | Logo Design | Photoshop | Vector Design,,,,"I need a fresh, memorable logo for my new company, Ground Up Construction. Think clean, sleek, elegant and unmistakably modern, yet different from the over-used hard-hat or skyline clichés you see everywhere. The brand colours are set—navy #0B1F3B, g"
Freelancer.com,Scan-to-BIM MEP Modeling,https://www.freelancer.com/projects/revit/scan-bim-mep-modeling,20.0,20.0,USD,fixed,3D Modelling | Architectural Rendering | Architecture | AutoCAD | Autodesk Revit | Building Information Modeling | CAD/CAM | Construction Management | Revit | Solidworks,,,,"I have existing scan data for a healthcare project (PCH) and need a clean, well-organized BIM model that focuses on the mechanical, electrical, and plumbing disciplines. The scans capture the as-built conditions; your task is to interpret that inform"
Freelancer.com,Marketing Product Demonstration Video Creation,https://www.freelancer.com/projects/motion-graphics/marketing-product-demonstration-video,281.0,281.0,USD,fixed,Adobe Premiere Pro | Animation | Final Cut Pro | Motion Graphics | Video Editing | Video Production | Video Services | Voice Over,,,,"I’m ready to roll out a series of crisp, persuasive product-demonstration videos that spotlight key features, solve buyer objections, and drive conversions across our website, email funnels, and social channels. Each clip needs to feel authentic and "
Freelancer.com,Personal Brand PR Scaling,https://www.freelancer.com/projects/articles/personal-brand-scaling,36.0,36.0,USD,fixed,Article Writing | Brand Management | Content Marketing | Content Strategy | Content Writing | Copywriting | Creative Writing | Media Relations | Public Relations | Social Media Marketing,,,,"I am seeking a freelance PR expert to move my profile from 850 followers to a national authority. I want to be the household name for ""Healthy Ageing"" and ""Functional Grit"" in Australia.


Secure features in major Australian press (The SMH, Daily Tel"
Freelancer.com,Google Play Game Upload,https://www.freelancer.com/projects/android-app-development/google-play-game-upload,24.0,24.0,USD,fixed,Android App Development | App Design | App Publication | App Reskin | App Store Optimization | Game Design | Game Development | Mobile App Development | Mobile App Testing | Mobile Development,,,,"I have an unfinished project that I am still working on, and I need someone who can help me publish it on Google Play. However, my account already has a limited number of projects uploaded. What I would like is for you to select one of the existing p"
Freelancer.com,Custom Logo for Rent-Break Website,https://www.freelancer.com/contest/custom-logo-for-rentbreak-website-2736529,30.0,30.0,USD,fixed,Branding | Creative Design | Graphic Design | Illustration | Illustrator | Logo Design | Photoshop | Visual Design,,,,"I need a logo for my website. take a look at it here:     The colors are #F5F5F2
#D9D4CC
#B08D57
#2D3136
#6D1F2F
#4A0F1A   I would like the final logo outlined in gold around the logo. The concept of this service is to give people a financial break f"
Freelancer.com,Monthly SEO for Shopify Store,https://www.freelancer.com/projects/shopify-site/monthly-seo-for-shopify-store,26.0,26.0,USD,fixed,Analytics | Competitor Analysis | Internet Marketing | Keyword Research | Link Building | Marketing | SEO | Shopify,,,,"I run an e-commerce shop on Shopify and I’m setting aside a steady $30 each month for ongoing SEO. The site already ranks for a few terms, but I have a mixed keyword list that still needs expansion and refinement, so keyword research and gap analysis"
Freelancer.com,"Creative Solutions - Design, Media, Data entry, writing, and Content Creation",https://www.freelancer.com/projects/video-editing/creative-solutions-design-media-data,11.0,11.0,USD,fixed,Branding | Content Creation | Copywriting | Creative Writing | Graphic Design | Logo Design | Photo Editing | Social Media Marketing | Video Editing | Voice Over,,,,"•Turning Vision Into Value: Creative Solutions for Your Next Project
Are you looking for a creative partner who combines technical versatility with a fresh, dedicated perspective?
For years, I have been honing a diverse suite of creative skills behin"
Freelancer.com,Premium App Icon needed – BMX/Pump Track Locator (PTL),https://www.freelancer.com/contest/premium-app-icon-needed-ndash-bmxpump-track-locator-ptl-2736527,25.0,25.0,USD,fixed,Adobe Illustrator | Adobe Photoshop | App Design | App Development | Graphic Design | Icon Design | Logo Design | UI / User Interface | User Interface / IA | Vector Design,,,,"Project Title: Professional App Icon Refinement (STRICT TECHNICAL REQUIREMENTS)

Overview:
We are seeking a precision-focused graphic designer to finalize an app icon for a high-end mobile application. We are looking for professional quality, not gen"
Freelancer.com,Fuzzy logic doubts,https://www.freelancer.com/projects/teaching-lecturing/fuzzy-logic-doubts,2.0,2.0,USD,fixed,Algorithm | Engineering | Mathematics | Matlab and Mathematica | Teaching/Lecturing,,,,Fuzzy logic tutoring on doubts.
Freelancer.com,Agentic AI Engineer to help optimize our media monitoring stack,https://www.freelancer.com/projects/agentic-ai/agentic-engineer-help-optimize-our,24.0,24.0,USD,fixed,Agentic AI | AI Agents | AI Development | AI Model Development | AI Research | AI Text-to-text | Data Scraping | Natural Language Understanding | Social Networking,,,,"Agentic AI Engineer — Optimize Our Media Monitoring Stack (Policy / Public Affairs)

About the Role

We run a media monitoring operation in the public policy space and need an experienced agentic AI engineer to help us **optimize an existing stack** "
Freelancer.com,Online Discussion,https://www.freelancer.com/projects/technical-writing/online-discussion,15.0,15.0,USD,fixed,Report Writing | Technical Writing,,,,"Read the information in the pictures. read, follow instructions, and reply."
Freelancer.com,Cinematic Insta360 Kitesurfing Edit,https://www.freelancer.com/projects/color-grading/cinematic-insta-kitesurfing-edit,100.0,100.0,USD,fixed,360-degree video | Adobe Premiere Pro | After Effects | Animation | Color Grading | Final Cut Pro | Video Editing | Video Production,,,,"I’ve captured hours of kitesurfing footage on an Insta360 X3 and now need a skilled editor to turn it into a cinematic showcase. You’ll be working with raw 5.7-K 360° clips, selecting the best angles through key-framing, using FlowState stabilization"
Freelancer.com,Dissertation Editing for Doctoral Readiness,https://www.freelancer.com/projects/academic-writing/dissertation-editing-for-doctoral,330.0,330.0,USD,fixed,Academic Writing | Copy Editing | Editing | Proofreading | Research | Research Writing | Technical Writing | Writing Tutoring,,,,"I'm seeking a skilled dissertation editor to prepare my doctoral dissertation for committee review. Your expertise will ensure my work meets high academic standards.

Key requirements include:
- APA 7 Formatting: Ensure accurate citations, references"
Freelancer.com,Game Data Retrieval API,https://www.freelancer.com/projects/api-developmet/game-data-retrieval-api,640.0,640.0,USD,fixed,Android | API Development | Backend Development | Data Management | Game Development | Java | Mobile App Development | PHP,,,,"I am looking for a developer or a development team to create a professional VTC management system for ETS2/ATS as a web-based platform with a driver panel, administration panel, and telemetry integration connected to user accounts.

The system should"
Freelancer.com,Audit Corporate Website for AI Search,https://www.freelancer.com/projects/web-development/audit-corporate-website-for-search,145.0,145.0,USD,fixed,AI Chatbot | AI Content Creation | Content Strategy | Internet Marketing | Link Building | Search Engine Marketing | SEO | Web Development,,,,"I need a detailed, plain-English audit that tells me whether my corporate site is truly friendly to AI-driven search on Google. Please crawl and analyse the pages, structured data, content layout, internal linking, and any technical signals that matt"
Freelancer.com,Convert Sketches to Fusion 360,https://www.freelancer.com/projects/fusion-360/convert-sketches-fusion,100.0,100.0,USD,fixed,3D Design | 3D Drafting | 3D Modelling | 3D Printing | 3D Rendering | CAD/CAM | Fusion 360,,,,"I have a set of hand-drawn sketches for several 3D-printed woodworking templates and jigs that I now need recreated inside Autodesk Fusion 360. Once the models are in Fusion I’ll be able to tweak, nest, and export them for printing on my own, so accu"
Freelancer.com,Drawing Congo Real Estate Drawings,https://www.freelancer.com/projects/electrical-engineering/drawing-congo-real-estate-drawings,5276.0,5276.0,USD,fixed,Architectural Engineering | Architecture | Civil Engineering | Construction Engineering | Electrical Engineering | Electronic Design | Engineering Drawing | HVAC | Plumbing | Real Estate,,,,"I will soon issue a full drawing package—over 1000 m²—for a new development in the Republic of Congo.  If you are a full-case designer or Agency who can undertake the construction drawings of building structures, HVAC, and electricity, you can also c"
Freelancer.com,Gen Z Oriented T-Shirt Slogan Copywriter,https://www.freelancer.com/projects/graphic-design/gen-oriented-shirt-slogan-copywriter-40419265,376.0,376.0,USD,fixed,Advertising | Branding | Content Writing | Copywriting | Creative Writing | Digital Marketing | Graphic Design | Logo Design | Slogans | T-Shirts,,,,"You are a professional copywriter hired by a modern youth-focused T-shirt brand. Your goal is to write creative, catchy, and memorable slogans, taglines, and ad captions for their new clothing line.

This T-shirt brand mainly targets Gen Z and young "
Freelancer.com,I need a writer,https://www.freelancer.com/projects/article-rewriting/need-writer-35816149,19.0,19.0,USD,fixed,Article Rewriting | Article Writing | Content Writing | Research Writing | Technical Writing,,,,"Making choices about sentence boundaries:

Post a paragraph of writing you have done recently. 

Example of completed assignment under “Example of an initial post”"
Freelancer.com,I need a writer - 23/01/2023 04:53 EST,https://www.freelancer.com/projects/article-rewriting/need-writer-est,20.0,20.0,USD,fixed,Article Rewriting | Article Writing | Content Writing | Research Writing | Technical Writing,,,,"Making choices about sentence boundaries:

Post a paragraph of writing you have done recently. 

Example of completed assignment under “Example of an initial post”"
Freelancer.com,Fix Search System Glitch on Health Directory Website,https://www.freelancer.com/projects/html/fix-search-system-glitch-health,170.0,170.0,USD,fixed,HTML | JavaScript | MySQL | PHP | WordPress,,,,"I need a skilled developer to fix a glitch in the search system on my health directory website in Australia. Currently, when no results are found, the system redirects users to a random location instead of retaining the location they provided. The go"
Freelancer.com,Streetwear & Casual Apparel Designs,https://www.freelancer.com/contest/streetwear-amp-casual-apparel-designs-2736520,190.0,190.0,USD,fixed,Creative Design | Fashion Consulting | Fashion Design | Fashion Modeling | Fashion Writing | Graphic Design | Logo Design | T-Shirts,,,,"I'm seeking a talented designer to create unique and trendy designs for my brand. Initially, I need designs for hats, with plans to expand to shirts, pants, and gym apparel.

Requirements:
- Designs for casual, streetwear, and gym apparel styles
- Or"
Freelancer.com,Statewide Strata Committee Research,https://www.freelancer.com/projects/data-collection/statewide-strata-committee-research,74.0,74.0,USD,fixed,Data Collection | Data Entry | Data Management | Data Mining | Data Scraping | Excel | Google Sheets | Web Search,,,,"I need a current, accurate list of strata committee decision-makers operating across NSW,  sole focus is usable contact information, so each record must include three fields: a direct email address, a working phone number, and the committee’s officia"
Freelancer.com,LLP Forms & DSC Signing,https://www.freelancer.com/projects/accounting/llp-forms-dsc-signing,40.0,40.0,USD,fixed,Accounting | Business Consulting | Compliance | Corporate Law | Financial Consulting | Legal | Tax | Tax Compliance,,,,"LLP Form 3 and Form 5 are fully drafted and the supporting documents are already in order. The next step is to have a practising Chartered Accountant or Company Secretary attach a valid Class-3 DSC, complete any mandatory verification, and submit bot"
Freelancer.com,WordPress Website for Car Removal Service,https://www.freelancer.com/projects/html/wordpress-website-for-car-removal,318.0,318.0,USD,fixed,HTML | PHP | Web Design | Website Design | Website Development | WordPress | WordPress Design | WordPress Plugin,,,,"I am launching a cash-for-cars and car-removal service and need a clean, modern WordPress site that I can maintain through the standard WP dashboard. The build is intentionally simple but must look current, load fast, and work flawlessly on mobile as"
Freelancer.com,Internalized Oppression Research Paper,https://www.freelancer.com/projects/academic-writing/internalized-oppression-research-paper,25.0,25.0,USD,fixed,Academic Writing | Data Analysis | Psychology | Qualitative Research | Report Writing | Research | Research Writing | Technical Writing,,,,"I need a 12-page academic paper that investigates internalized oppression within immigrant communities. The study must be grounded in qualitative analysis, integrating current scholarship and, where useful, first-hand narratives to illuminate how int"
Freelancer.com,Facebook Post Content Design,https://www.freelancer.com/projects/graphic-design/facebook-post-content-design,107.0,107.0,USD,fixed,Branding | Content Creation | Copywriting | Graphic Design | Illustration | Social Media Management | Social Media Marketing | Visual Design,,,,"I’m looking for a creative hand to take over the design and copy of my Facebook posts. The goal is to keep the feed fresh with scroll-stopping visuals and captions that fit the tone of my brand while driving engagement on the page.

What I need from "
Freelancer.com,KPI Screencast With English Voiceover,https://www.freelancer.com/projects/video-editing/kpi-screencast-with-english-voiceover,111.0,111.0,USD,fixed,After Effects | Animation | Audio Production | Audio Services | Video Editing | Video Production | Voice Over | Voice Talent,,,,"I want a concise screencast that walks our management team through a single KPI page on our website and shows them exactly how to read and use each metric. The video should be recorded directly from your screen while you narrate in clear, fluent Engl"
Freelancer.com,AI Nature Discovery & Exploration Platform,https://www.freelancer.com/projects/react-native/nature-discovery-exploration-platform,9.0,9.0,USD,fixed,AI Model Development | Caricature & Cartoons | Graphic Design | Illustration | Logo Design | MongoDB | Node.js | React Native,,,,"I’m building an AI-powered nature discovery and exploration platform for web and mobile that combines species identification, autogenerated field-guide profiles, community-driven identification, and gamified outdoor exploration. Users will be able to"
Freelancer.com,AI-Based Trading Card Grading App Development,https://www.freelancer.com/projects/ai-development/based-trading-card-grading-app,1197.0,1197.0,USD,fixed,AI Development | API Development | Backend Development | Flutter | Image Analysis | Machine Learning (ML) | Mobile App Development | Payment Processing | Python | React Native,,,,"JOB POSTING: Senior Mobile App Developer / Full‑Stack Team Needed for AI‑Powered Grading & Marketplace App

Position: Senior Mobile App Developer (iOS + Android) or Full Development Team

Project Type: Full Build (Front‑End, Back‑End, AI Integration,"
Freelancer.com,Remove Fake Google Reviews,https://www.freelancer.com/projects/customer-service/remove-fake-google-reviews-40424526,409.0,409.0,USD,fixed,Article Rewriting | Article Writing | Conflict Resolution | Customer Service | Digital Marketing | Internet Marketing | SEO | Social Media Management,,,,"I have six to ten clearly fake negative reviews sitting on my Google Business Profile that violate Google’s own review policies. I need a professional who already understands Google’s dispute, flagging and escalation workflow inside-out and can get e"
Freelancer.com,Luxury Car Detailing Logo,https://www.freelancer.com/contest/luxury-car-detailing-logo-2736519,50.0,50.0,USD,fixed,Adobe Illustrator | Adobe Photoshop | Branding | Graphic Design | Illustration | Illustrator | Logo Design | Photoshop | Typography | Visual Design,,,,"I need a logo for my car detailing business, ""Five Detailing Co.""

Requirements:
- Do not use ""5 Auto Detailing"" .. Use ""Five Detailing Co.""
- Can use Knoxville, TN and EST. 2023
- Stay away from using a car. I like the idea of a wheel or tire. I'm o"
Freelancer.com,FNSACC601 Tax Assessment Revision Australian Tax Compliance Expert Needed,https://www.freelancer.com/projects/tax-compliance/fnsacc-tax-assessment-revision-40424083,6.0,8.0,USD,fixed,Accounting | Audit | Finance | Financial Analysis | Financial Consulting | Tax Compliance | Tax Law | Tax Preparation | Tax Risk Management,,,,"Overview
I need an experienced Australian tax compliance professional to revise and complete a FNSACC601 assessment. This project requires updating the work based on assessor feedback to ensure it meets the standards for a Satisfactory result.

Scope"
Freelancer.com,Corporate Promo Video Creation,https://www.freelancer.com/projects/motion-graphics/corporate-promo-video-creation,58.0,58.0,USD,fixed,After Effects | Animation | Motion Graphics | Post-Production | Script Writing | Video Editing | Video Services | Voice Over,,,,"I need a concise, engaging video that introduces my company and highlights our products and services to potential customers. The final piece should feel corporate yet lively, combining clear information with a promotional flair that drives brand awar"
Freelancer.com,Interactive Billboard Inventory Website,https://www.freelancer.com/projects/web-development/interactive-billboard-inventory-website,15.0,15.0,USD,fixed,CMS | Graphic Design | HTML | PHP | React.js | Web Application | Web Design | Web Development | Website Design | WordPress,,,,"I run UT Outdoors, an outdoor-billboard company, and I need a clean, modern site that feels as intuitive and visually bold as TrailheadMedia.com. The entire experience should revolve around showcasing our current inventory, so the interactive map mus"
Freelancer.com,Private project or contest #40424520,"https://www.freelancer.com/login?goto=YzQ3OGQ3MTMwZTFlOGI5OTZmOTI3ZGUyYjY3NTFiNzRodHRwczovL3d3dy5mcmVlbGFuY2VyLmNvbS9wcm9qZWN0cy9hY2NvdW50aW5nL3BlcnNvbmFsLXF1aWNrZW4tYmFuay1yZWNvbmNpbGlhdGlvbg,,",,,,unknown,Accounting | Bank Reconciliation | Bookkeeping | Data Entry | Data Management | Finance | Financial Analysis | Financial Consulting,,,,PleaseSign UporLoginto see details.
Freelancer.com,Odoo GST & TDS Reporting Help,https://www.freelancer.com/projects/odoo/odoo-gst-tds-reporting-help,10.0,10.0,USD,fixed,Accounting | ERP | Odoo | Tax Compliance,,,,"Not looking for Odoo developer but someone having core expertise in Odoo in India finance. 

I run my books on Odoo and now need an experienced hand to get the Indian tax side running smoothly. Specifically, I must produce accurate GST and TDS report"
Freelancer.com,Modern Brand Identity Logo Design,https://www.freelancer.com/projects/adobe-illustrator/modern-brand-identity-logo-design-40424516,190.0,190.0,USD,fixed,Adobe Illustrator | Branding | Creative Design | Graphic Design | Illustrator | Logo Design | Vector Design | Visual Design,,,,"I need a fresh, modern logo that can stand at the centre of my brand identity. The visual tone should feel contemporary—think of the clean, uncluttered aesthetics you often see in today’s modern-style posters—yet it still has to translate perfectly a"
