platform,title_raw,title_clean,cleaned_text,full_description,tokens,token_count,budget_extracted,budget_currency,budget_type,skills_clean,category_clean,posted_date
Mostaqel.com,تصميم منصة تعليمية,تصميم منصه تعليميه مصمم مواقع وتطبيقات لتصميم منصه تعليميه web app phone app شرط يكون عنده سابقه اعمال قويه او لديه مشرو,تصميم منصه تعليميه مصمم مواقع وتطبيقات لتصميم منصه تعليميه web app phone app شرط يكون عنده سابقه اعمال قويه او لديه مشروعات سابقه ضع ميزانيتك العرض,مطلوب مصمم مواقع وتطبيقات لتصميم منصة تعليمية web app و phone app شرط يكون عنده سابقة اعمال قوية او لديه مشروعات سابقة ضع ميزانيتك في العرض,تصميم | منصه | تعليميه | مصمم | مواقع | وتطبيقات | لتصميم | منصه | تعليميه | web | app | phone | app | شرط | يكون | عنده | سابقه | اعمال | قويه | او | لديه | مشروعات | سابقه | ضع | ميزانيتك | العرض,26,,,unknown,,,2026-05-06 09:37:53
Mostaqel.com,مصمم جرافيك محترف,مصمم جرافيك محترف احتاج مصمم جرافيك محترف، يشتغل علي برامج الادوبي.,مصمم جرافيك محترف احتاج مصمم جرافيك محترف، يشتغل علي برامج الادوبي.,احتاج مصمم جرافيك محترف، يشتغل على برامج الادوبي.,مصمم | جرافيك | محترف | احتاج | مصمم | جرافيك | محترف، | يشتغل | علي | برامج | الادوبي.,11,,,unknown,,,2026-05-06 09:36:49
Mostaqel.com,مخططات تفصيلية تنفيذية لمشروع سكني,مخططات تفصيليه تنفيذيه لمشروع سكني محتاج اعمل مخططات تننفيذيه معماريه انشاييه لمشروع سكني عباره 42 فيلا متطابقه ومبنيين ,مخططات تفصيليه تنفيذيه لمشروع سكني محتاج اعمل مخططات تننفيذيه معماريه انشاييه لمشروع سكني عباره 42 فيلا متطابقه ومبنيين تجاري سكني متطابقين,محتاج أعمل مخططات تننفيذية معمارية و انشائية لمشروع سكني عبارة عن 42 فيلا متطابقة ومبنيين تجاري سكني متطابقين,مخططات | تفصيليه | تنفيذيه | لمشروع | سكني | محتاج | اعمل | مخططات | تننفيذيه | معماريه | انشاييه | لمشروع | سكني | عباره | 42 | فيلا | متطابقه | ومبنيين | تجاري | سكني | متطابقين,21,,,unknown,,,2026-05-06 09:24:36
Mostaqel.com,إعادة تصميم موقع إلكتروني وتحسين تجربة الطلبات,اعاده تصميم موقع الكتروني وتحسين تجربه الطلبات شركه السعوديه متخصصه تفصيل اغطيه حمايه الاثاث المقاس,اعاده تصميم موقع الكتروني وتحسين تجربه الطلبات شركه السعوديه متخصصه تفصيل اغطيه حمايه الاثاث المقاس,نحن شركة في السعودية متخصصة في تفصيل أغطية حماية  الأثاث (حسب المقاس).,اعاده | تصميم | موقع | الكتروني | وتحسين | تجربه | الطلبات | شركه | السعوديه | متخصصه | تفصيل | اغطيه | حمايه | الاثاث | المقاس,15,,,unknown,,,2026-05-06 09:07:33
Mostaqel.com,متجر إلكتروني كامل,متجر الكتروني كامل احتاج مستقل بخبره عندي متجر حقيقي يحتوي الاف المنتجات، اريد ان اعمله متجر الكتروني بالكامل العلم ان ا,متجر الكتروني كامل احتاج مستقل بخبره عندي متجر حقيقي يحتوي الاف المنتجات، اريد ان اعمله متجر الكتروني بالكامل العلم ان الشخص المطلوب سيعمل تنزيل المتجات الجديده فتره واحتاج ان ترسل عينات,احتاج مستقلّ بخبره عندي متجر حقيقي يحتوي الاف المنتجات، اريد ان اعمله متجر الكتروني بالكامل مع العلم ان الشخص المطلوب سيعمل ع تنزيل المتجات الجديدة كل فتره واحتاج ان ترسل عينات للعمل,متجر | الكتروني | كامل | احتاج | مستقل | بخبره | عندي | متجر | حقيقي | يحتوي | الاف | المنتجات، | اريد | ان | اعمله | متجر | الكتروني | بالكامل | العلم | ان | الشخص | المطلوب | سيعمل | تنزيل | المتجات | الجديده | فتره | واحتاج | ان | ترسل | عينات,31,,,unknown,,,2026-05-06 08:58:26
Mostaqel.com,مصمم موشن جرافيك / إنفوجرافيك احترافي,مصمم موشن جرافيك انفوجرافيك احترافي مستقل محترف لانتاج فيديو انفو جرافيك موشن جرافيك احترافي لمده اجماليه تقارب 30 دقيقه,مصمم موشن جرافيك انفوجرافيك احترافي مستقل محترف لانتاج فيديو انفو جرافيك موشن جرافيك احترافي لمده اجماليه تقارب 30 دقيقه، يتم تقسيمه الي حلقات قصيره، مده حلقه تقريبا دقيقتان او اقل، باسلوب احترافي مشوق وجذاب.,نبحث عن مستقل محترف لإنتاج فيديو إنفو جرافيك / موشن جرافيك احترافي لمدة إجمالية تقارب 30 دقيقة، يتم تقسيمه إلى حلقات قصيرة، مدة كل حلقة تقريبًا دقيقتان أو أقل، بأسلوب احترافي مشوق وجذاب.,مصمم | موشن | جرافيك | انفوجرافيك | احترافي | مستقل | محترف | لانتاج | فيديو | انفو | جرافيك | موشن | جرافيك | احترافي | لمده | اجماليه | تقارب | 30 | دقيقه، | يتم | تقسيمه | الي | حلقات | قصيره، | مده | حلقه | تقريبا | دقيقتان | او | اقل، | باسلوب | احترافي | مشوق | وجذاب.,34,,,unknown,,,2026-05-06 08:50:19
Mostaqel.com,نشر بحث في مجلة طبية سكوبس,نشر بحث مجله طبيه سكوبس احتاج اكاديمي لديه خبره بالنشر العلمي مجلات دوليه,نشر بحث مجله طبيه سكوبس احتاج اكاديمي لديه خبره بالنشر العلمي مجلات دوليه,احتاج أكاديمي لديه خبرة بالنشر العلمي في مجلات دولية,نشر | بحث | مجله | طبيه | سكوبس | احتاج | اكاديمي | لديه | خبره | بالنشر | العلمي | مجلات | دوليه,13,,,unknown,,,2026-05-06 08:46:29
Mostaqel.com,إنشاء إعلانات بالذكاء الاصطناعي,انشاء اعلانات بالذكاء الاصطناعي اريد عده اعلانات مدرسيه لمناسبات تخص المدرسه باستخدام الذكاء الاصطناعي,انشاء اعلانات بالذكاء الاصطناعي اريد عده اعلانات مدرسيه لمناسبات تخص المدرسه باستخدام الذكاء الاصطناعي,اريد عدة إعلانات مدرسية لمناسبات تخص المدرسة باستخدام الذكاء الاصطناعي,انشاء | اعلانات | بالذكاء | الاصطناعي | اريد | عده | اعلانات | مدرسيه | لمناسبات | تخص | المدرسه | باستخدام | الذكاء | الاصطناعي,14,,,unknown,,,2026-05-06 08:18:46
Mostaqel.com,خبير حملات إعلانية,خبير حملات اعلانيه ميديا باير محترف معنا علي تحليل وتحسين الاداء الاعلاني لمشروع تعليمي.,خبير حملات اعلانيه ميديا باير محترف معنا علي تحليل وتحسين الاداء الاعلاني لمشروع تعليمي.,نبحث عن ميديا باير محترف للعمل معنا على تحليل وتحسين الأداء الإعلاني لمشروع تعليمي.,خبير | حملات | اعلانيه | ميديا | باير | محترف | معنا | علي | تحليل | وتحسين | الاداء | الاعلاني | لمشروع | تعليمي.,14,,,unknown,,,2026-05-06 08:13:44
Mostaqel.com,صانع فيديوهات بالذكاء الاصطناعي,صانع فيديوهات بالذكاء الاصطناعي اعلان صانع فيديوهات بالذكاء الاصطناعي ai,صانع فيديوهات بالذكاء الاصطناعي اعلان صانع فيديوهات بالذكاء الاصطناعي ai,إعلان: مطلوب صانع فيديوهات بالذكاء الاصطناعي (AI),صانع | فيديوهات | بالذكاء | الاصطناعي | اعلان | صانع | فيديوهات | بالذكاء | الاصطناعي | ai,10,,,unknown,,,2026-05-06 08:04:08
Mostaqel.com,حل مشكلة تعطل حساب جوجل ماب و عدم إرسال البطاقة البريدية,حل مشكله تعطل حساب جوجل ماب عدم ارسال البطاقه البريديه حل مشكله تعطل حساب جوجل ماب عدم وصول البطاقه البريديه,حل مشكله تعطل حساب جوجل ماب عدم ارسال البطاقه البريديه حل مشكله تعطل حساب جوجل ماب عدم وصول البطاقه البريديه,حل مشكلة تعطل حساب جوجل ماب و عدم وصول البطاقه البريدية,حل | مشكله | تعطل | حساب | جوجل | ماب | عدم | ارسال | البطاقه | البريديه | حل | مشكله | تعطل | حساب | جوجل | ماب | عدم | وصول | البطاقه | البريديه,20,,,unknown,,,2026-05-06 07:59:11
Mostaqel.com,تجميع بيانات شركات من مواقع معروفة,تجميع بيانات شركات مواقع معروفه السلام عليكم اريد شخص يقوم بمهمه تجميع وترتيب بيانات شركات,تجميع بيانات شركات مواقع معروفه السلام عليكم اريد شخص يقوم بمهمه تجميع وترتيب بيانات شركات,السلام عليكم اريد شخص يقوم بمهمة تجميع وترتيب بيانات شركات,تجميع | بيانات | شركات | مواقع | معروفه | السلام | عليكم | اريد | شخص | يقوم | بمهمه | تجميع | وترتيب | بيانات | شركات,15,,,unknown,,,2026-05-06 07:56:22
Mostaqel.com,تصميم فيديو ترويجي لنظام ERP,تصميم فيديو ترويجي لنظام erp يهدف الي انتاج فيديو ترويجي احترافي يعرض نظام erp الخاص بالشركه، التركيز علي ابراز القيمه ا,تصميم فيديو ترويجي لنظام erp يهدف الي انتاج فيديو ترويجي احترافي يعرض نظام erp الخاص بالشركه، التركيز علي ابراز القيمه الحقيقيه يقدمها للعملاء تحسين الكفاءه التشغيليه، تقليل التكاليف، وتعزيز اتخاذ القرار.,يهدف هذا المشروع إلى إنتاج فيديو ترويجي احترافي يعرض نظام ERP الخاص بالشركة، مع التركيز على إبراز القيمة الحقيقية التي يقدمها للعملاء من حيث تحسين الكفاءة التشغيلية، تقليل التكاليف، وتعزيز اتخاذ القرار.,تصميم | فيديو | ترويجي | لنظام | erp | يهدف | الي | انتاج | فيديو | ترويجي | احترافي | يعرض | نظام | erp | الخاص | بالشركه، | التركيز | علي | ابراز | القيمه | الحقيقيه | يقدمها | للعملاء | تحسين | الكفاءه | التشغيليه، | تقليل | التكاليف، | وتعزيز | اتخاذ | القرار.,31,,,unknown,,,2026-05-06 07:55:23
Mostaqel.com,تلخيص محتوى pdf,تلخيص محتوي pdf لدي ملف pdf تعليمي يحتوي علي 884 صفحه واكثر الصفحات يكون عباره او عبارتين فقط وهذا السبب صفحات الملف كثي,تلخيص محتوي pdf لدي ملف pdf تعليمي يحتوي علي 884 صفحه واكثر الصفحات يكون عباره او عبارتين فقط وهذا السبب صفحات الملف كثيره جدا وارغب بشخص يعمل علي قراءه الصفحات ويلخص ويدمج ويقلص عدد صفحات الملف سواء طريق بوربوينت او اي برنامج فاهم ان يخل بالمحتوي التعليمي بمعني اريد المحتوي التعليمي باعاده ترتيب وتقليل الصفحات الي ان تصبح اقل 200 صفحه,"لدي ملف pdf تعليمي يحتوي على 884 صفحة , واكثر هذه الصفحات يكون فيها عبارة او عبارتين فقط وهذا السبب الذي جعل صفحات الملف كثيرة جدًا , وارغب بشخص يعمل على قراءة جميع الصفحات ويلخص ويدمج ويقلص من عدد صفحات هذا الملف سواء عن طريق بوربوينت او اي برنامج هو فاهم فيه ولكن دون ان يخل بالمحتوى التعليمي , بمعنى اريد المحتوى التعليمي كما هو ولكن بإعادة ترتيب وتقليل الصفحات الى ان تصبح اقل من 200 صفحة",تلخيص | محتوي | pdf | لدي | ملف | pdf | تعليمي | يحتوي | علي | 884 | صفحه | واكثر | الصفحات | يكون | عباره | او | عبارتين | فقط | وهذا | السبب | صفحات | الملف | كثيره | جدا | وارغب | بشخص | يعمل | علي | قراءه | الصفحات | ويلخص | ويدمج | ويقلص | عدد | صفحات | الملف | سواء | طريق | بوربوينت | او | اي | برنامج | فاهم | ان | يخل | بالمحتوي | التعليمي | بمعني | اريد | المحتوي | التعليمي | باعاده | ترتيب | وتقليل | الصفحات | الي | ان | تصبح | اقل | 200 | صفحه,61,,,unknown,,,2026-05-06 07:53:56
Mostaqel.com,مونتير خبرة لاتقل عن 5 سنوات بميزانية شهرية,مونتير خبره لاتقل سنوات بميزانيه شهريه اريد مونتير محترف بميزانيه شهريه يعمل معي ٣٠ بوم ومايكون مشغول يوم احتاج مونتاج ف,مونتير خبره لاتقل سنوات بميزانيه شهريه اريد مونتير محترف بميزانيه شهريه يعمل معي ٣٠ بوم ومايكون مشغول يوم احتاج مونتاج فيديوهات قصيره وفيديوهات طويله المجال التجاره والتسويق,اريد مونتير محترف بميزانية شهرية يعمل معي ٣٠ بوم ومايكون مشغول كل يوم احتاج مونتاج فيديوهات قصيره وفيديوهات طويلة المجال عن التجاره والتسويق,مونتير | خبره | لاتقل | سنوات | بميزانيه | شهريه | اريد | مونتير | محترف | بميزانيه | شهريه | يعمل | معي | ٣٠ | بوم | ومايكون | مشغول | يوم | احتاج | مونتاج | فيديوهات | قصيره | وفيديوهات | طويله | المجال | التجاره | والتسويق,27,,,unknown,,,2026-05-06 07:52:48
Mostaqel.com,مصمم فيديو ريلز محترف,مصمم فيديو ريلز محترف سلام عليكم ورحمه الله وبركاته,مصمم فيديو ريلز محترف سلام عليكم ورحمه الله وبركاته,سلام عليكم ورحمة الله وبركاته,مصمم | فيديو | ريلز | محترف | سلام | عليكم | ورحمه | الله | وبركاته,9,,,unknown,,,2026-05-06 07:46:50
Mostaqel.com,تحسين أكواد التتبع,تحسين اكواد التتبع لدينا حملات اعلانيه علي جوجل ادز ونرغب بتحسين اكواد التتبع وقنوات التواصل,تحسين اكواد التتبع لدينا حملات اعلانيه علي جوجل ادز ونرغب بتحسين اكواد التتبع وقنوات التواصل,لدينا حملات اعلانية على جوجل ادز ونرغب بتحسين اكواد التتبع وقنوات التواصل,تحسين | اكواد | التتبع | لدينا | حملات | اعلانيه | علي | جوجل | ادز | ونرغب | بتحسين | اكواد | التتبع | وقنوات | التواصل,15,,,unknown,,,2026-05-06 07:44:39
Mostaqel.com,صناعة ديمو للعبة على محرك انريل 5,صناعه ديمو للعبه علي محرك انريل احتاج شخص متمرس علي محرك انريل لصناعه يدمو بسيط للعبه منظور,صناعه ديمو للعبه علي محرك انريل احتاج شخص متمرس علي محرك انريل لصناعه يدمو بسيط للعبه منظور,احتاج شخص متمرس على محرك انريل 5 لصناعة يدمو بسيط للعبة من منظور ثالث,صناعه | ديمو | للعبه | علي | محرك | انريل | احتاج | شخص | متمرس | علي | محرك | انريل | لصناعه | يدمو | بسيط | للعبه | منظور,17,,,unknown,,,2026-05-06 07:42:31
Mostaqel.com,إعداد قوائم عرض بخدمات وأسعارها حسب السوق السعودى قابلة للتعديل,اعداد قوايم عرض بخدمات واسعارها السوق السعودي قابله للتعديل احتاج لعمل قوايم تعرض علي العميل خلال اعلان او تطبيقات الوات,اعداد قوايم عرض بخدمات واسعارها السوق السعودي قابله للتعديل احتاج لعمل قوايم تعرض علي العميل خلال اعلان او تطبيقات الواتساب او التيك توك,أحتاج لعمل قوائم تعرض على العميل من خلال إعلان أو تطبيقات مثل الواتساب أو التيك توك,اعداد | قوايم | عرض | بخدمات | واسعارها | السوق | السعودي | قابله | للتعديل | احتاج | لعمل | قوايم | تعرض | علي | العميل | خلال | اعلان | او | تطبيقات | الواتساب | او | التيك | توك,23,,,unknown,,,2026-05-06 07:40:07
Mostaqel.com,تصميم داخلي وواجهة عمارة ومدخلها,تصميم داخلي وواجهه عماره ومدخلها الموقع عباره عماره شقق وفيلا دور ونصف,تصميم داخلي وواجهه عماره ومدخلها الموقع عباره عماره شقق وفيلا دور ونصف,الموقع عبارة عن عمارة خمس شقق وفيلا دور ونصف,تصميم | داخلي | وواجهه | عماره | ومدخلها | الموقع | عباره | عماره | شقق | وفيلا | دور | ونصف,12,,,unknown,,,2026-05-06 07:37:53
Mostaqel.com,تصميم واجهة رئيسية,تصميم واجهه رييسيه السلام عليكم،,تصميم واجهه رييسيه السلام عليكم،,السلام عليكم،,تصميم | واجهه | رييسيه | السلام | عليكم،,5,,,unknown,,,2026-05-06 07:30:58
Mostaqel.com,مدرب متخصص في برامج الذكاء الاصطناعي,مدرب متخصص برامج الذكاء الاصطناعي السلام عليكم,مدرب متخصص برامج الذكاء الاصطناعي السلام عليكم,السلام عليكم,مدرب | متخصص | برامج | الذكاء | الاصطناعي | السلام | عليكم,7,,,unknown,,,2026-05-06 07:24:39
Mostaqel.com,شعار لشركة تطوير عقاري أسمها AKZAN,شعار لشركه تطوير عقاري اسمها akzan مصمم جرافيك محترف لتصميم نماذج شعارات عصريه ومبتكره لشركه تطوير عقاري باسم,شعار لشركه تطوير عقاري اسمها akzan مصمم جرافيك محترف لتصميم نماذج شعارات عصريه ومبتكره لشركه تطوير عقاري باسم,نبحث عن مصمم جرافيك محترف لتصميم 3 نماذج شعارات عصرية ومبتكرة لشركة تطوير عقاري باسم:,شعار | لشركه | تطوير | عقاري | اسمها | akzan | مصمم | جرافيك | محترف | لتصميم | نماذج | شعارات | عصريه | ومبتكره | لشركه | تطوير | عقاري | باسم,18,,,unknown,,,2026-05-06 07:23:07
Mostaqel.com,عمل تطبيق بث مباشر فيديو وصوت بنظام الوكالات والألعاب,عمل تطبيق بث مباشر فيديو وصوت بنظام الوكالات والالعاب احتاج مبرمج محترف لعمل تطبيق بث مباشر فيديو وصوت بوبو لايف، يتضمن ,عمل تطبيق بث مباشر فيديو وصوت بنظام الوكالات والالعاب احتاج مبرمج محترف لعمل تطبيق بث مباشر فيديو وصوت بوبو لايف، يتضمن غرف بث فيديو وصوت، نظام وكالات كامل، العاب تفاعليه داخل البث، وطرق سحب ارباح متعدده للمستخدمين والوكلاء.,"أحتاج مبرمج محترف لعمل تطبيق بث مباشر (فيديو وصوت) مثل بوبو لايف، يتضمن: غرف بث فيديو وصوت، نظام وكالات كامل، ألعاب تفاعلية داخل البث، وطرق سحب أرباح متعددة للمستخدمين والوكلاء.""",عمل | تطبيق | بث | مباشر | فيديو | وصوت | بنظام | الوكالات | والالعاب | احتاج | مبرمج | محترف | لعمل | تطبيق | بث | مباشر | فيديو | وصوت | بوبو | لايف، | يتضمن | غرف | بث | فيديو | وصوت، | نظام | وكالات | كامل، | العاب | تفاعليه | داخل | البث، | وطرق | سحب | ارباح | متعدده | للمستخدمين | والوكلاء.,38,,,unknown,,,2026-05-06 07:19:16
Mostaqel.com,تطوير قسم الورشة والمستودعات لشركة نقل,تطوير قسم الورشه والمستودعات لشركه نقل السلام عليكم ورحمه الله وبركاته,تطوير قسم الورشه والمستودعات لشركه نقل السلام عليكم ورحمه الله وبركاته,"السلام عليكم ورحمة الله وبركاته ,,",تطوير | قسم | الورشه | والمستودعات | لشركه | نقل | السلام | عليكم | ورحمه | الله | وبركاته,11,,,unknown,,,2026-05-06 07:14:51
Mostaqel.com,مطلوب B2B Sales Closer قوي للتواصل مع عيادات زراعة الأسنان وإغلاق شراكات,b2b sales closer قوي للتواصل عيادات زراعه الاسنان واغلاق شراكات ابحث شخص قوي مبيعات b2b عبر الهاتف وواتساب للتواصل عيادا,b2b sales closer قوي للتواصل عيادات زراعه الاسنان واغلاق شراكات ابحث شخص قوي مبيعات b2b عبر الهاتف وواتساب للتواصل عيادات الاسنان واقناعهم بالتعاون معنا خدمه متخصصه لجلب مرضي زراعه الاسنان.,أبحث عن شخص قوي في مبيعات B2B عبر الهاتف وواتساب للتواصل مع عيادات الأسنان وإقناعهم بالتعاون معنا في خدمة متخصصة لجلب مرضى زراعة الأسنان.,b2b | sales | closer | قوي | للتواصل | عيادات | زراعه | الاسنان | واغلاق | شراكات | ابحث | شخص | قوي | مبيعات | b2b | عبر | الهاتف | وواتساب | للتواصل | عيادات | الاسنان | واقناعهم | بالتعاون | معنا | خدمه | متخصصه | لجلب | مرضي | زراعه | الاسنان.,30,,,unknown,,,2026-05-06 07:05:10
Mostaqel.com,Media Buyer محترف لإعلانات عيادات زراعة الأسنان,media buyer محترف لاعلانات عيادات زراعه الاسنان media buyer محترف لحملات زراعه الاسنان علي فيسبوك وجوجل,media buyer محترف لاعلانات عيادات زراعه الاسنان media buyer محترف لحملات زراعه الاسنان علي فيسبوك وجوجل,مطلوب Media Buyer محترف لحملات زراعة الأسنان على فيسبوك وجوجل,media | buyer | محترف | لاعلانات | عيادات | زراعه | الاسنان | media | buyer | محترف | لحملات | زراعه | الاسنان | علي | فيسبوك | وجوجل,16,,,unknown,,,2026-05-06 07:03:01
