platform,title_raw,title_clean,cleaned_text,full_description,tokens,token_count,budget_extracted,budget_currency,budget_type,skills_clean,category_clean,posted_date
Freelancer.com,Backyard Landscape Plan & Renderings,backyard landscape plan renderings 2d drafting 2d drawing 3d design 3d rendering 3d visualization architectural visualiz,backyard landscape plan renderings 2d drafting 2d drawing 3d design 3d rendering 3d visualization architectural visualization autocad building architecture interior design landscape design,,backyard | landscape | plan | renderings | 2d | drafting | 2d | drawing | 3d | design | 3d | rendering | 3d | visualization | architectural | visualization | autocad | building | architecture | interior | design | landscape | design,23,102.5,USD,fixed,2d drafting | 2d drawing | 3d design | 3d rendering | 3d visualization | architectural visualization | autocad | building architecture | interior design | landscape design,,
Freelancer.com,Private project or contest #40424614,private project contest 40424614 article writing data collection educational research qualitative research report writin,private project contest 40424614 article writing data collection educational research qualitative research report writing research research writing statistical analysis,,private | project | contest | 40424614 | article | writing | data | collection | educational | research | qualitative | research | report | writing | research | research | writing | statistical | analysis,19,,,unknown,article writing | data collection | educational research | qualitative research | report writing | research | research writing | statistical analysis,,
Freelancer.com,"Performance Ads Expert Needed (Meta, Google & CRM Integration)",performance ads expert needed meta google crm integration crm digital marketing facebook ads google ads internet marketi,performance ads expert needed meta google crm integration crm digital marketing facebook ads google ads internet marketing lead generation leads php sales social video marketing,,performance | ads | expert | needed | meta | google | crm | integration | crm | digital | marketing | facebook | ads | google | ads | internet | marketing | lead | generation | leads | php | sales | social | video | marketing,25,63.0,USD,fixed,crm | digital marketing | facebook ads | google ads | internet marketing | lead generation | leads | php | sales | social video marketing,,
Freelancer.com,Salesforce Data Import Specialist,salesforce data import specialist crm data analysis data entry data management data processing excel salesforce app deve,salesforce data import specialist crm data analysis data entry data management data processing excel salesforce app development salesforce.com,,salesforce | data | import | specialist | crm | data | analysis | data | entry | data | management | data | processing | excel | salesforce | app | development | salesforce.com,18,27.0,USD,fixed,crm | data analysis | data entry | data management | data processing | excel | salesforce app development | salesforce.com,,
Freelancer.com,AI Content Generator Development,ai content generator development ai chatbot development ai content creation ai development ai model development ai writi,ai content generator development ai chatbot development ai content creation ai development ai model development ai writing artificial intelligence css html html5 javascript,,ai | content | generator | development | ai | chatbot | development | ai | content | creation | ai | development | ai | model | development | ai | writing | artificial | intelligence | css | html | html5 | javascript,23,462.0,USD,fixed,ai chatbot development | ai content creation | ai development | ai model development | ai writing | artificial intelligence | css | html | html5 | javascript,,
Freelancer.com,DaVinci Resolve Training Edits,davinci resolve training edits audio editing davinci resolve editing video editing video post-editing video processing v,davinci resolve training edits audio editing davinci resolve editing video editing video post-editing video processing video production video services,,davinci | resolve | training | edits | audio | editing | davinci | resolve | editing | video | editing | video | post-editing | video | processing | video | production | video | services,19,65.0,USD,fixed,audio editing | davinci resolve | editing | video editing | video post-editing | video processing | video production | video services,,
Freelancer.com,Translate Manual: English to Nepali -- 2,translate manual english nepali -- copy typing copywriting editing english us translator english translation nepali tran,translate manual english nepali -- copy typing copywriting editing english us translator english translation nepali translator proofreading technical translation technical writing translation,,translate | manual | english | nepali | -- | copy | typing | copywriting | editing | english | us | translator | english | translation | nepali | translator | proofreading | technical | translation | technical | writing | translation,22,300.0,USD,fixed,copy typing | copywriting | editing | english us translator | english translation | nepali translator | proofreading | technical translation | technical writing | translation,,
Freelancer.com,Experienced Claude Code Developer needed,experienced claude code developer needed ai artificial intelligence hw sw ai agents claude code model context protocol m,experienced claude code developer needed ai artificial intelligence hw sw ai agents claude code model context protocol mcp next.js openai prompt engineering python,,experienced | claude | code | developer | needed | ai | artificial | intelligence | hw | sw | ai | agents | claude | code | model | context | protocol | mcp | next.js | openai | prompt | engineering | python,23,16.0,USD,fixed,ai artificial intelligence hw sw | ai agents | claude code | model context protocol mcp | next.js | openai | prompt engineering | python,,
Freelancer.com,Translate Manual: English to Nepali,translate manual english nepali editing english us translator english translation nepali translator proofreading technic,translate manual english nepali editing english us translator english translation nepali translator proofreading technical translation technical writing translation,,translate | manual | english | nepali | editing | english | us | translator | english | translation | nepali | translator | proofreading | technical | translation | technical | writing | translation,18,250.0,USD,fixed,editing | english us translator | english translation | nepali translator | proofreading | technical translation | technical writing | translation,,
Freelancer.com,Unique Modern Construction Logo Design,unique modern construction logo design adobe illustrator adobe photoshop branding graphic design illustrator logo design,unique modern construction logo design adobe illustrator adobe photoshop branding graphic design illustrator logo design photoshop vector design,,unique | modern | construction | logo | design | adobe | illustrator | adobe | photoshop | branding | graphic | design | illustrator | logo | design | photoshop | vector | design,18,35.0,USD,fixed,adobe illustrator | adobe photoshop | branding | graphic design | illustrator | logo design | photoshop | vector design,,
Freelancer.com,Scan-to-BIM MEP Modeling,scan-to-bim mep modeling 3d modelling architectural rendering architecture autocad autodesk revit building information m,scan-to-bim mep modeling 3d modelling architectural rendering architecture autocad autodesk revit building information modeling cad cam construction management revit solidworks,,scan-to-bim | mep | modeling | 3d | modelling | architectural | rendering | architecture | autocad | autodesk | revit | building | information | modeling | cad | cam | construction | management | revit | solidworks,20,20.0,USD,fixed,3d modelling | architectural rendering | architecture | autocad | autodesk revit | building information modeling | cad cam | construction management | revit | solidworks,,
Freelancer.com,Marketing Product Demonstration Video Creation,marketing product demonstration video creation adobe premiere pro animation final cut pro motion graphics video editing ,marketing product demonstration video creation adobe premiere pro animation final cut pro motion graphics video editing video production video services voice,,marketing | product | demonstration | video | creation | adobe | premiere | pro | animation | final | cut | pro | motion | graphics | video | editing | video | production | video | services | voice,21,281.0,USD,fixed,adobe premiere pro | animation | final cut pro | motion graphics | video editing | video production | video services | voice,,
Freelancer.com,Personal Brand PR Scaling,personal brand pr scaling article writing brand management content marketing content strategy content writing copywritin,personal brand pr scaling article writing brand management content marketing content strategy content writing copywriting creative writing media relations public relations social media marketing,,personal | brand | pr | scaling | article | writing | brand | management | content | marketing | content | strategy | content | writing | copywriting | creative | writing | media | relations | public | relations | social | media | marketing,24,36.0,USD,fixed,article writing | brand management | content marketing | content strategy | content writing | copywriting | creative writing | media relations | public relations | social media marketing,,
Freelancer.com,Google Play Game Upload,google play game upload android app development app design app publication app reskin app store optimization game design,google play game upload android app development app design app publication app reskin app store optimization game design game development mobile app development mobile app testing mobile development,,google | play | game | upload | android | app | development | app | design | app | publication | app | reskin | app | store | optimization | game | design | game | development | mobile | app | development | mobile | app | testing | mobile | development,28,24.0,USD,fixed,android app development | app design | app publication | app reskin | app store optimization | game design | game development | mobile app development | mobile app testing | mobile development,,
Freelancer.com,Custom Logo for Rent-Break Website,custom logo rent-break website branding creative design graphic design illustration illustrator logo design photoshop vi,custom logo rent-break website branding creative design graphic design illustration illustrator logo design photoshop visual design,,custom | logo | rent-break | website | branding | creative | design | graphic | design | illustration | illustrator | logo | design | photoshop | visual | design,16,30.0,USD,fixed,branding | creative design | graphic design | illustration | illustrator | logo design | photoshop | visual design,,
Freelancer.com,Monthly SEO for Shopify Store,monthly seo shopify store analytics competitor analysis internet marketing keyword research link building marketing seo ,monthly seo shopify store analytics competitor analysis internet marketing keyword research link building marketing seo shopify,,monthly | seo | shopify | store | analytics | competitor | analysis | internet | marketing | keyword | research | link | building | marketing | seo | shopify,16,26.0,USD,fixed,analytics | competitor analysis | internet marketing | keyword research | link building | marketing | seo | shopify,,
Freelancer.com,"Creative Solutions - Design, Media, Data entry, writing, and Content Creation",creative solutions design media data entry writing content creation branding content creation copywriting creative writi,creative solutions design media data entry writing content creation branding content creation copywriting creative writing graphic design logo design photo editing social media marketing video editing voice,,creative | solutions | design | media | data | entry | writing | content | creation | branding | content | creation | copywriting | creative | writing | graphic | design | logo | design | photo | editing | social | media | marketing | video | editing | voice,27,11.0,USD,fixed,branding | content creation | copywriting | creative writing | graphic design | logo design | photo editing | social media marketing | video editing | voice,,
Freelancer.com,Premium App Icon needed – BMX/Pump Track Locator (PTL),premium app icon needed bmx pump track locator ptl adobe illustrator adobe photoshop app design app development graphic ,premium app icon needed bmx pump track locator ptl adobe illustrator adobe photoshop app design app development graphic design icon design logo design ui user interface user interface ia vector design,,premium | app | icon | needed | bmx | pump | track | locator | ptl | adobe | illustrator | adobe | photoshop | app | design | app | development | graphic | design | icon | design | logo | design | ui | user | interface | user | interface | ia | vector | design,31,25.0,USD,fixed,adobe illustrator | adobe photoshop | app design | app development | graphic design | icon design | logo design | ui user interface | user interface ia | vector design,,
Freelancer.com,Fuzzy logic doubts,fuzzy logic doubts algorithm engineering mathematics matlab mathematica teaching lecturing,fuzzy logic doubts algorithm engineering mathematics matlab mathematica teaching lecturing,,fuzzy | logic | doubts | algorithm | engineering | mathematics | matlab | mathematica | teaching | lecturing,10,2.0,USD,fixed,algorithm | engineering | mathematics | matlab mathematica | teaching lecturing,,
Freelancer.com,Agentic AI Engineer to help optimize our media monitoring stack,agentic ai engineer help optimize media monitoring stack agentic ai ai agents ai development ai model development ai res,agentic ai engineer help optimize media monitoring stack agentic ai ai agents ai development ai model development ai research ai text-to-text data scraping natural language understanding social networking,,agentic | ai | engineer | help | optimize | media | monitoring | stack | agentic | ai | ai | agents | ai | development | ai | model | development | ai | research | ai | text-to-text | data | scraping | natural | language | understanding | social | networking,28,24.0,USD,fixed,agentic ai | ai agents | ai development | ai model development | ai research | ai text-to-text | data scraping | natural language understanding | social networking,,
Freelancer.com,Online Discussion,online discussion report writing technical writing,online discussion report writing technical writing,,online | discussion | report | writing | technical | writing,6,15.0,USD,fixed,report writing | technical writing,,
Freelancer.com,Cinematic Insta360 Kitesurfing Edit,cinematic insta360 kitesurfing edit 360-degree video adobe premiere pro effects animation color grading final cut pro vi,cinematic insta360 kitesurfing edit 360-degree video adobe premiere pro effects animation color grading final cut pro video editing video production,,cinematic | insta360 | kitesurfing | edit | 360-degree | video | adobe | premiere | pro | effects | animation | color | grading | final | cut | pro | video | editing | video | production,20,100.0,USD,fixed,360-degree video | adobe premiere pro | effects | animation | color grading | final cut pro | video editing | video production,,
Freelancer.com,Dissertation Editing for Doctoral Readiness,dissertation editing doctoral readiness academic writing copy editing editing proofreading research research writing tec,dissertation editing doctoral readiness academic writing copy editing editing proofreading research research writing technical writing writing tutoring,,dissertation | editing | doctoral | readiness | academic | writing | copy | editing | editing | proofreading | research | research | writing | technical | writing | writing | tutoring,17,330.0,USD,fixed,academic writing | copy editing | editing | proofreading | research | research writing | technical writing | writing tutoring,,
Freelancer.com,Game Data Retrieval API,game data retrieval api android api development backend development data management game development java mobile app dev,game data retrieval api android api development backend development data management game development java mobile app development php,,game | data | retrieval | api | android | api | development | backend | development | data | management | game | development | java | mobile | app | development | php,18,640.0,USD,fixed,android | api development | backend development | data management | game development | java | mobile app development | php,,
Freelancer.com,Audit Corporate Website for AI Search,audit corporate website ai search ai chatbot ai content creation content strategy internet marketing link building searc,audit corporate website ai search ai chatbot ai content creation content strategy internet marketing link building search engine marketing seo web development,,audit | corporate | website | ai | search | ai | chatbot | ai | content | creation | content | strategy | internet | marketing | link | building | search | engine | marketing | seo | web | development,22,145.0,USD,fixed,ai chatbot | ai content creation | content strategy | internet marketing | link building | search engine marketing | seo | web development,,
Freelancer.com,Convert Sketches to Fusion 360,convert sketches fusion 360 3d design 3d drafting 3d modelling 3d printing 3d rendering cad cam fusion 360,convert sketches fusion 360 3d design 3d drafting 3d modelling 3d printing 3d rendering cad cam fusion 360,,convert | sketches | fusion | 360 | 3d | design | 3d | drafting | 3d | modelling | 3d | printing | 3d | rendering | cad | cam | fusion | 360,18,100.0,USD,fixed,3d design | 3d drafting | 3d modelling | 3d printing | 3d rendering | cad cam | fusion 360,,
Freelancer.com,Drawing Congo Real Estate Drawings,drawing congo real estate drawings architectural engineering architecture civil engineering construction engineering ele,drawing congo real estate drawings architectural engineering architecture civil engineering construction engineering electrical engineering electronic design engineering drawing hvac plumbing real estate,,drawing | congo | real | estate | drawings | architectural | engineering | architecture | civil | engineering | construction | engineering | electrical | engineering | electronic | design | engineering | drawing | hvac | plumbing | real | estate,22,5276.0,USD,fixed,architectural engineering | architecture | civil engineering | construction engineering | electrical engineering | electronic design | engineering drawing | hvac | plumbing | real estate,,
Freelancer.com,Gen Z Oriented T-Shirt Slogan Copywriter,gen oriented t-shirt slogan copywriter advertising branding content writing copywriting creative writing digital marketi,gen oriented t-shirt slogan copywriter advertising branding content writing copywriting creative writing digital marketing graphic design logo design slogans t-shirts,,gen | oriented | t-shirt | slogan | copywriter | advertising | branding | content | writing | copywriting | creative | writing | digital | marketing | graphic | design | logo | design | slogans | t-shirts,20,376.0,USD,fixed,advertising | branding | content writing | copywriting | creative writing | digital marketing | graphic design | logo design | slogans | t-shirts,,
Freelancer.com,I need a writer,need writer article rewriting article writing content writing research writing technical writing,need writer article rewriting article writing content writing research writing technical writing,,need | writer | article | rewriting | article | writing | content | writing | research | writing | technical | writing,12,19.0,USD,fixed,article rewriting | article writing | content writing | research writing | technical writing,,
Freelancer.com,I need a writer - 23/01/2023 04:53 EST,need writer 23 01 2023 04 53 est article rewriting article writing content writing research writing technical writing,need writer 23 01 2023 04 53 est article rewriting article writing content writing research writing technical writing,,need | writer | 23 | 01 | 2023 | 04 | 53 | est | article | rewriting | article | writing | content | writing | research | writing | technical | writing,18,20.0,USD,fixed,article rewriting | article writing | content writing | research writing | technical writing,,
Freelancer.com,Fix Search System Glitch on Health Directory Website,fix search system glitch health directory website html javascript mysql php wordpress,fix search system glitch health directory website html javascript mysql php wordpress,,fix | search | system | glitch | health | directory | website | html | javascript | mysql | php | wordpress,12,170.0,USD,fixed,html | javascript | mysql | php | wordpress,,
Freelancer.com,Streetwear & Casual Apparel Designs,streetwear casual apparel designs creative design fashion consulting fashion design fashion modeling fashion writing gra,streetwear casual apparel designs creative design fashion consulting fashion design fashion modeling fashion writing graphic design logo design t-shirts,,streetwear | casual | apparel | designs | creative | design | fashion | consulting | fashion | design | fashion | modeling | fashion | writing | graphic | design | logo | design | t-shirts,19,190.0,USD,fixed,creative design | fashion consulting | fashion design | fashion modeling | fashion writing | graphic design | logo design | t-shirts,,
Freelancer.com,Statewide Strata Committee Research,statewide strata committee research data collection data entry data management data mining data scraping excel google sh,statewide strata committee research data collection data entry data management data mining data scraping excel google sheets web search,,statewide | strata | committee | research | data | collection | data | entry | data | management | data | mining | data | scraping | excel | google | sheets | web | search,19,74.0,USD,fixed,data collection | data entry | data management | data mining | data scraping | excel | google sheets | web search,,
Freelancer.com,LLP Forms & DSC Signing,llp forms dsc signing accounting business consulting compliance corporate law financial consulting legal tax tax complia,llp forms dsc signing accounting business consulting compliance corporate law financial consulting legal tax tax compliance,,llp | forms | dsc | signing | accounting | business | consulting | compliance | corporate | law | financial | consulting | legal | tax | tax | compliance,16,40.0,USD,fixed,accounting | business consulting | compliance | corporate law | financial consulting | legal | tax | tax compliance,,
Freelancer.com,WordPress Website for Car Removal Service,wordpress website car removal service html php web design website design website development wordpress wordpress design ,wordpress website car removal service html php web design website design website development wordpress wordpress design wordpress plugin,,wordpress | website | car | removal | service | html | php | web | design | website | design | website | development | wordpress | wordpress | design | wordpress | plugin,18,318.0,USD,fixed,html | php | web design | website design | website development | wordpress | wordpress design | wordpress plugin,,
Freelancer.com,Internalized Oppression Research Paper,internalized oppression research paper academic writing data analysis psychology qualitative research report writing res,internalized oppression research paper academic writing data analysis psychology qualitative research report writing research research writing technical writing,,internalized | oppression | research | paper | academic | writing | data | analysis | psychology | qualitative | research | report | writing | research | research | writing | technical | writing,18,25.0,USD,fixed,academic writing | data analysis | psychology | qualitative research | report writing | research | research writing | technical writing,,
Freelancer.com,Facebook Post Content Design,facebook post content design branding content creation copywriting graphic design illustration social media management s,facebook post content design branding content creation copywriting graphic design illustration social media management social media marketing visual design,,facebook | post | content | design | branding | content | creation | copywriting | graphic | design | illustration | social | media | management | social | media | marketing | visual | design,19,107.0,USD,fixed,branding | content creation | copywriting | graphic design | illustration | social media management | social media marketing | visual design,,
Freelancer.com,KPI Screencast With English Voiceover,kpi screencast english voiceover effects animation audio production audio services video editing video production voice ,kpi screencast english voiceover effects animation audio production audio services video editing video production voice voice talent,,kpi | screencast | english | voiceover | effects | animation | audio | production | audio | services | video | editing | video | production | voice | voice | talent,17,111.0,USD,fixed,effects | animation | audio production | audio services | video editing | video production | voice | voice talent,,
